{
  "item_id": "0b1f2a3c-4d5e-4f60-8a7b-9c0d1e2f3a4b",
  "kind": "action_approval",
  "subtype": "proposal",
  "tenant_id": "5325ffe9-5727-4d88-9832-aebabb8d0538",
  "producer": "olive",
  "producer_ref": "7c9e6679-7425-40de-944b-e07fc1f90ae7",
  "subject_ref": "olive:proposal/7c9e6679-7425-40de-944b-e07fc1f90ae7",
  "payload_ref": "olive:proposal/7c9e6679-7425-40de-944b-e07fc1f90ae7",
  "state": "open",
  "age_seconds": 12,
  "created_at": "2026-01-01T00:00:00Z"
}
